Stock,Headline
AAPL,Apple partners with Affirm to maintain competitive edge in US mobile wallet space
AAPL,"Apple's halo shines bright in smartphone supply chain, even with consumer demand concerns"
AAPL,Watch These Amazon Price Levels as Stock Reaches $2 Trillion Market Cap
AAPL,Amazon Becomes Fifth US Company To Reach $2 Trillion Market Cap
AAPL,Nasdaq Leads Gains While Microsoft Remains In Buy Zone; This Blue Chip Breaks Out (Live Coverage)
AAPL,Apple Hopes To Stand Out As Privacy-Focused AI Company
AAPL,"Why You Shouldnt Buy an iPhone This Summer. All the Reasons, From A to I."
AAPL,Apple has fixed multiple security issues with its devices this year
AAPL,Europe is at the gates of Apples walled garden
AAPL,Apple admits its Airpods had a security problem
AAPL,"Magnificent Seven Stocks: Nvidia Stock Slides, Tesla Rallies, Amazon Breaks Out"
AAPL,Rosenblatt upgrades Apple to buy
AAPL,3 Stocks Poised for a Major Turnaround: Expert Picks for Massive Gains
AAPL,"Rosenblatt upgrades Apple to Buy, lifts price target to $260"
AAPL,Apple Stock Catches an Upgrade. How the iPhone Should Win With AI.
AAPL,"This Growth Stock Might Be Ready to Go Parabolic, and It Is Incredibly Cheap Right Now"
AAPL,Big Tech Stocks Are Picking Up Nvidias Slack. Thats a Positive for the Market Rally.
AAPL,Apple Expands Self Service Repair Diagnostics support to 32 European Countries
AAPL,The Aussie Gambler's Oasis: Exploring Top Online Casinos in Australia
AAPL,Apple and FedEx upgraded: Wall Street's top analyst calls
AAPL,Regulatory Clouds Are Mounting Over Apple
AAPL,The 7 Smartest Consumer Stocks to Buy With $500 Right Now
AAPL,Why the Vanguard Information Technology ETF Is One of the Best Ways to Invest in Artificial Intelligence (AI)
AAPL,You've Been Warned! 3 Blockchain Stocks to Buy Now or Regret Forever
AAPL,In Q1-24 Apple's latest MacBook Air notebooks gave them a great boost in annual growth
AAPL,"Avatech, that works with LG, will produce Foldable Laptop Ultrathin Glass (UTG) in 2026 that could be used in Apple's first Foldable iPad"
AAPL,Forget Just 1 AI Stock: This Trio Could Power Your Portfolio's Future
AAPL,Microsoft Stock Predictions: Is MSFT Headed to $5 Trillion?
AAPL,3 Cheap Stocks Getting Ready for a Second-Half Surge
AAPL,"Hey, Artificial Intelligence Fans! 3 Long-Term AI Stocks to Load Up on Now."
AAPL,"In Mainland China, Xiaomi beat Apple in the TWS earbuds market in Q1-24 through buy-one-get-one-free promotions"
AAPL,"Huawei smartphone sales see biggest growth in 618 shopping festival, but Apple stays ahead"
AAPL,Prediction: 3 Unstoppable Artificial Intelligence (AI) Stocks Will Be Bigger Than Nvidia in 2030
AAPL,Large Caps Other Than Nvidia Are Now Bolstering the Market
AAPL,Apple's unique bets on M-Series chips for AI servers
AAPL,"Apple Intelligence and Meta Integration Hoopla, Revisiting Apple Intelligence Integration Monetization"
AAPL,Wearable Devices Ltd. (WLDS): Did This Popular AI Penny Stock Show Excellent Growth in the Last Quarter?
AAPL,Apple wins a Patent for a Specialized Medical Accessory for the iPhone that is designed to detect Viruses
AAPL,Apple iPhone 16 Sales Likely 'Stronger For Longer'
AAPL,You've Been Warned! 3 Nanotech Stocks to Buy Now or Regret Forever
AAPL,Nvidia's stock is rebounding after it lost half a trillion in market value
AAPL,EU keeps flexing its antitrust muscles with US tech giants
AAPL,"Nvidia, EU targets Microsoft, reactions to Yellen: Morning Brief"
AAPL,Nvidia stock set to continue rebound after snapping a 3-day rout
AAPL,Nvidia stock pops to snap three-day rout
AAPL,Nvidia stock pops to snap 3-day rout
AAPL,Apple rejected Meta's pursuit of AI partnership: BBG
AAPL,Apple TV+ has Announced a new Psychological Thriller Series titled 'Disclaimer' that's set to debut in October
AAPL,A small group of tech stocks is driving the market rally  why that's 'not a flaw'
AAPL,"Apple Stock Got an AI Boost From WWDC. It Can Keep Going, Says Analyst."
AAPL,It's not just Apple. The EU Charges Microsoft with Antitrust Violations over bundling Video Conferencing in with their Teams App
AAPL,EC accuses Apple App Store policies of violating DMA rules
AAPL,"Apple rejected Meta's attempt to put its AI on the iPhone, report says"
AAPL,Acer Skyrockets ahead of Apple in India's Tablet Market in Q1-24 due to Education Sales
AAPL,3 Fintech Stocks to Buy if You Are Looking to Build Wealth
AAPL,Apple TV+ Announces a Gritty new German Hospital Drama titled 'KRANK Berlin' and more
AAPL,Apple Inc. (AAPL) is Attracting Investor Attention: Here is What You Should Know
AAPL,"Microsoft Teams Bundling May Have Violated Antitrust Law, EU Says"
AAPL,"Microsoft's 'abusive' bundling of Office and Teams breaks antitrust rules, Europe says"
AAPL,Apple wins a patent for a wide variety of possible future Vision Pro Headband mechanisms & configurations for added user comfort
AAPL,5 Things to Know Before the Stock Market Opens
AAPL,Analyst Says Taiwan Semiconductor (TSM) is the Key Beneficiary of AI Prosperity'
AAPL,Apple Inc (NASDAQ:AAPL): The Best Undervalued AI Stock to Buy Now?
AAPL,Microsoft Accused by EU of Antitrust Breaches. Why Teams Is Becoming a Flashpoint.
AAPL,This is Who Owns the Most Apple Stock. Hint: It's Not Tim Cook.
AAPL,3 Record-Breaking Stocks With More Room to Run
AAPL,3 Flying Car Stocks That Could Make Your Grandchildren Rich
AAPL,Apple wins a Smartglasses patent for Near-Eye Displays that produce Holographic Optical Elements
AAPL,Billionaires Just Poured About $67 Billion Into These 5 Artificial Intelligence (AI) Stocks
AAPL,The most important stock market chart of 2024: Morning Brief
AAPL,"Ding, Ding, Ding: It's Time to Buy the Recovery in Apple Stock."
AAPL,2 Artificial Intelligence (AI) Stocks That Could Go Parabolic
AAPL,EV Chargers: The geographic forces driving electric vehicle adoption
AAPL,Wistron to invest US$24.5 Million to build new factory in Vietnam's Ha Nam Province
AAPL,Samsung poised to overtake Apple in Taiwan's mobile market by June
AAPL,Apple is reportedly planning to set up a Data Center in Taiwan just as they delay plans for a Research Center in North Carolina
AAPL,India reportedly to require common charging ports for smartphones in mid-2025
AAPL,Evercore says AI could help Apple crush 2025 iPhone growth estimates
AAPL,"Apple Opens First Store in Malaysia, Apple and Emerging Markets, Signal-to-Noise"
AAPL,"Nvidia, Microsoft, or Apple: Which $3 Trillion-Dollar Stock Is the Better Artificial Intelligence (AI) Play?"
AAPL,"Apple, Meta not in talks currently for AI partnership, Bloomberg News reports"
AAPL,"Crypto under pressure, Good Buy or Goodbye: Market Domination"
AAPL,Where Will Apple Stock Be in 3 Years?
AAPL,Apple spurned idea of iPhone AI partnership with Meta months ago
AAPL,Goldman Sachs Is Pounding the Table on Affirm (AFRM) Stock
AAPL,Unlocking the Super Powers of Supercommunicators
AAPL,IBD Stock Of The Day Meta Eyes Buy Point After Report Of AI Talks With Apple
AAPL,Apple Hit by First Charges Under New European Tech Law
AAPL,Apple stock will see little impact from EU probe: Analyst
AAPL,"These Stocks Are Moving the Most Today: Nvidia, Apple, Trump Media, RXO, ResMed, Alnylam, Affirm, IBM, and More"
AAPL,European Union Challenges Weigh On Apple Stock
AAPL,Nvidia stock falls more than 6% as investors rotate out of chip heavyweight
AAPL,"Apple's market cap to hit $4 trillion next year, says Wedbush's Dan Ives"
AAPL,3 China Stocks to Buy on the Dip: June 2024
AAPL,Apple reportedly in talks with Meta for AI partnership
AAPL,Apple charged under new EU competition law: Here's what you need to know
AAPL,NVDA Stock: 3 Things to Watch Ahead of the Nvidia Shareholder Meeting
AAPL,EU says Apple breached DMA regulations
AAPL,Wall Street Favorites: 3 Mutual Funds With Strong Buy Ratings for June 2024
AAPL,The 3 Smartest Warren Buffett Stocks to Buy With $500 Right Now
